child,parent,description
JC337-S-2015,JC,Solidarity
JC261-D-2016,JC,State phobia and civil society : the political legacy of Michel Foucault 
JA84-J-2015,JA,Western-centrism and contemporary Korean political thought 
JN543-V-2015,JN,Time and politics : parliament and the culture of modernity in Britain and the British world 
JC481-E-2015,JC,"Mythische moderne. English+""Fascism"
JQ1879-D-2015,JQ,Democratic renewal in Africa : trends and discourses 
JN8341-M-2015,JN,Cultures of anyone : studies on cultural democratization in the Spanish neoliberal crisis 
JA84-K-2015,JA,The crisis of German historicism : the early political thought of Hannah Arendt and Leo Strauss 
JN137-G-2015,JN,Government and political life in England and France
JZ1480-P-2015,JZ,Understanding the Department of State 
JA84-J-2015,JA,Changing referents : learning across space and time in China and the West 
JZ6374-N-2015,JZ,Spoiler groups and UN peacekeeping 
JC327-C-2016,JC,Sovereignty and superheroes 
JZ6368-C-2015,JZ,Civil war interventions and their benefits : unequal return 
JV8722-I-2015,JV,International migrants in Japan : contributions in an era of population decline 
JQ629-I-2016,JQ,Politics
JZ1242-S-2014,JZ,Strategic regions in 21st century power politics : zones of consensus and zones of conflict 
JV7590-H-2015,JV,Suspect families : DNA analysis
JZ1318-A-2016,JZ,The synchronization of national policies : ethnography of the global tribe of moderns 
JZ1323-J-2015,JZ,Track two diplomacy in theory and practice 
JN1129-B-2015,JN,Training minds for the war of ideas : Ashridge College
JV8490-T-2015,JV,Transnational migration and Asia : the question of return 
JZ6045-K-2016,JZ,Using carrots to bring peace? : negotiation and third party involvement 
JC423-C-2016,JC,Visionary pragmatism : radical and ecological democracy in neoliberal times 
JF799-C-2015,JF,Why policy representation matters : the consequences of ideological proximity between citizens and their governments 
JZ5578-A-2016,JZ,Windows of opportunity : how women seize peace negotiations for political change 
JZ6009-W-2015,JZ,WMD arms control in the Middle East : prospects
JZ5578-W-2015,JZ,Women and peace in the Islamic world : gender
JZ1310-W-2015,JZ,World politics at the edge of chaos : reflections on complexity and global life 
JC319-G-2015,JC,World politics of peace and war : geopolitics in another key : geography and civilization 
JZ1310-C-2015,JZ,You run the show or the show runs you : capturing Professor Harold W. Rood's strategic thought for a new generation 
JZ4997-A-2015,JZ,50 years of Singapore and the United Nations 
JL197-J-2014,JL,Dismantling Canada : Stephen Harper's new conservative agenda 
JC79-P-2015,JC,Economic equality and direct democracy in ancient Athens 
JF1525-I-2015,JF,E-democracy-- citizen rights in the world of the new computing paradigms : 6th International Conference
JC336-L-2015,JC,The great forgetting : the past
JZ5538-D-2016,JZ,Against apocalypse : recovering humanity's wholeness 
JK271-B-2015,JK,The associational state : American governance in the twentieth century 
JV6225-B-2014,JV,Borders
JZ6368-S-2016,JZ,The case against military intervention : why we do it and why it fails 
JZ1734-C-2015,JZ,China
JF801-C-2016,JF,Citizenship
JC347-O-2015,JC,Flowers that kill : communicative opacity in political spaces 
JQ1516-H-2015,JQ,Governing Taiwan and Tibet : democratic approaches 
JF1001-H-2015,JF,Handbook on social choice and voting 
JF1525-I-2015,JF,The image of the enemy : intelligence analysis of adversaries since 1945 
JV6225-B-2015,JV,Immigration and population 
JQ766-I-2015,JQ,Indonesia's ascent : power
JF1351-H-2015,JF,Managing complexity in the public services 
JZ5675-N-2016,JZ,Nonproliferation policy and nuclear posture : causes and consequences for the spread of nuclear weapons 
JC336-P-2016,JC,Panarchy : political theories of non-territorial states 
JZ5584-M-2016,JZ,The politics of trauma and peace-building : lessons from Northern Ireland 
JN40-P-2016,JN,Populism
JV105-R-2015,JV,Rethinking colonialism : comparative archaeological approaches 
JV6465-R-2015,JV,The rhetorics of US immigration : identity
JF1001-S-2015,JF,Secrecy and publicity in votes and debates 
JN30-P-2015,JN,Shaping EU policy from below : EU democracy and the Committee of the Regions 
JZ1570-S-2015,JZ,The substance of EU democracy promotion : concepts and cases 
JZ6369-T-2015,JZ,Theorising the responsibility to protect 
JN50-S-2016,JN,Transnational socialist networks in the 1970s : European community development aid and Southern enlargement 
JZ6385-K-2015,JZ,Trust and fear in civil wars : ending intrastate conflicts 
JZ1570-K-2016,JZ,War and intervention in the transnational public sphere : problem-solving and European identity-formation 
JZ5588-H-2015,JZ,(In)security and the production of international relations : the politics of securitisation in Europe 
JK421-D-2016,JK,Anticipatory policymaking : when government acts to prevent problems and why it is so difficult 
JA85-B-2015,JA,Communicative capacity : public encounters in participatory theory and practice 
JA85-K-2016,JA,Constrained elitism and contemporary democratic theory 
JQ1875-C-2016,JQ,Coping with crisis in African states 
JQ1729-K-2016,JQ,Democratization and social movements in South Korea : defiant institutionalization 
JZ6009-D-2016,JZ,Détente in Cold War Europe : politics and diplomacy in the Mediterranean and the Middle East 
JZ6009-B-2016,JZ,Diplomacy and security community-building : EU crisis management in the Western Mediterranean 
JF1525-E-2016,JF,Ethics and the future of spying : technology
JZ1733-Z-2016,JZ,Evolving identity politics and cross-strait relations : bridging theories of international relations and nationalism 
JZ5584-H-2015,JZ,The first Northern Ireland peace process : power-sharing
JQ1846-P-2015,JQ,Group conflict and political mobilization in Bahrain and the Arab Gulf : rethinking the rentier state 
JZ6368-S-2016,JZ,International intervention
JZ6045-V-2016,JZ,International multiparty mediation and conflict management : challenges of cooperation and coordination 
JV8131-I-2015,JV,Italian mobilities 
JV6029-L-2015,JV,Lives in transition : longitudinal analysis from historical sources 
JS78-T-2016,JS,Local governance and inter-municipal cooperation 
JV6035-B-2015,JV,Nationalism
JV7682-G-2016,JV,Nothing personal? : geographies of governing and activism in the British asylum system 
JN7825-O-2016,JN,The Oxford handbook of Swedish politics 
JC328-F-2015,JC,Political violence in Judaism
JZ1305-R-2016,JZ,The return of the theorists : dialogues with great thinkers in international relations 
JZ4841-M-2015,JZ,Saving the environment in Sub-Saharan Africa : organizational dynamics and effectiveness of NGOs in Cameroon 
JZ6373-J-2015,JZ,Societies under siege. Exploring how international economic sanctions (do not) work 
JF1525-H-2015,JF,Surveillance
JZ1318-S-2016,JZ,Understanding globalization : the social consequences of political
JF801-B-2015,JF,"Cittadinanza. English+""Citizenship "
JZ1405-F-2015,JZ,Diplomacy in Renaissance Rome : the rise of the resident ambassador 
JZ1253-H-2015,JZ,Emotional diplomacy : official emotion on the international stage 
JN40-E-2015,JN,EU civil society : patterns of cooperation
JQ292-F-2015,JQ,Fixing electoral boundaries in India : laws
JQ1828-H-2014,JQ,Hezbollah
JQ1539-L-2015,JQ,Hong Kong's indigenous democracy : origins
JV6342-I-2015,JV,International migration and ethnic relations : critical perspectives 
JC143-C-2015,JC,Machiavelli : a portrait 
JC312-M-2015,JC,Minority nations in multinational federations : a comparative study of Quebec and Wallonia 
JA84-L-2015,JA,Political realism and wisdom 
JV7711-R-2014,JV,Population
JV105-P-2016,JV,Postcolonial transitions in Europe : contexts
JA71-D-2015,JA,Rousseau and Hobbes : nature
JV185-S-2015,JV,Settlers in contested lands : territorial disputes and ethnic conflicts 
JA74-S-2015,JA,Social psychology and politics 
JC319-C-2015,JC,Companion to political geography. http:
JV6347-W-2016,JV,Women and migration in rural Europe : labour markets
JF851-A-2015,JF,Women representatives in Britain
JC337-C-2015,JC,Austerity and the third sector in Greece : civil society at the European frontline 
JF2051-P-2014,JF,Contemporary party politics 
JC423-D-2015,JC,Democracy in dialogue
JC423-E-2015,JC,The education of radical democracy 
JZ6368-H-2016,JZ,Humanitarian intervention and the AU-ECOWAS intervention treaties under international law : towards a theory of regional responsibility to protect 
JZ5584-M-2015,JZ,Peacemaking strategies in Cyprus : in search of lasting peace 
JA66-P-2015,JA,The political economy of governance : institutions
JQ1725-P-2016,JQ,The politics and international relations of modern Korea 
JN13-M-2015,JN,The politics of everyday Europe : constructing authority in the European Union 
JC481-R-2016,JC,The rise of fascism : history
JA85-R-2016,JA,The Routledge companion to social media and politics 
JK421-N-2015,JK,Smart citizens
JZ1639-T-2015,JZ,Turkey's public diplomacy 
JZ4841-A-2015,JZ,Autocratic and democratic external influences in post-Soviet Eurasia 
JF799-S-2015,JF,Beyond party members : changing approaches to partisan mobilization 
JK411-B-2015,JK,Boundaries of the state in US history 
JZ1308-C-2015,JZ,The cosmopolitan ideal : challenges and opportunities 
JZ5601-D-2015,JZ,Dialogue and conflict resolution : potential and limits 
JN50-J-2015,JN,The European Union and the rise of regionalist parties 
JQ1807-E-2016,JQ,The Europeanization of Turkish public policies : a scorecard 
JA71-B-2015,JA,Fortune and the Dao  : a comparative study of Machiavelli
JZ1318-F-2015,JZ,From globalization to world society : neo-institutional and systems-theoretical perspectives 
JZ1318-E-2015,JZ,Globalization development and social justice : a propositional political approach 
JF1081-G-2015,JF,Government anti-corruption strategies : a cross-cultural perspective 
JA75-I-2015,JA,The international handbook of political ecology 
JA83-C-2015,JA,Left and right : the small world of political ideas 
JV6225-M-2015,JV,Migration and social policy. Edited by Jenny Phillimore.
JZ4841-N-2015,JZ,The NGO challenge for international relations theory 
JC71-J-2015,JC,Philosophy and politics in Aristotle's Politics 
JQ36-D-2016,JQ,Political participation in Asia : typologies of political behavior across democratizing states 
JZ1308-P-2015,JZ,Politics and cosmopolitanism in a global age 
JN34-M-2016,JN,A 'macro-regional' Europe in the making : theoretical approaches and empirical evidence 
JQ1499-R-2016,JQ,Advancing the regional commons in the new East Asia 
JN6739-K-2015,JN,Bearslayers : the rise and fall of the Latvian National Communists 
JN36-D-2015,JN,Career behaviour and the European Parliament : all roads lead through Brussels? 
JN5452-C-2015,JN,The challenge of coalition government : the Italian case 
JZ1308-S-2015,JZ,The cosmopolitan potential of exclusive associations : criteria for assessing the advancement of cosmopolitan norms 
JQ1789-M-2015,JQ,Democracy and constitutional politics in Iran : a weberian analysis 
JC423-F-2015,JC,Democracy promotion by functional cooperation : the European Union and its neighbourhood 
JZ1308-B-2015,JZ,Empire within : international hierarchy and its imperial laboratories of governance 
JF1525-E-2015,JF,Entrepreneurship in the polis : understanding political entrepreneurship 
JN15-K-2015,JN,Experiencing European integration : transnational lives and European identity 
JZ1253-H-2016,JZ,Foreign policy in the twenty-first century 
JZ5538-G-2015,JZ,Gender and peacebuilding : all hands required 
JV6347-G-2015,JV,Gendered journeys : women
JA76-R-2015,JA,A genre approach to celebrity politics : global patterns of passage from media to politics 
JV6225-S-2016,JV,Governing climate induced migration and displacement : IGO expansions and global policy implications 
JV8752-I-2015,JV,International migration and development in South Asia 
JZ4839-I-2015,JZ,International organizations as orchestrators 
JC263-G-2015,JC,"Sguardo di Giano. English+""Janus's gaze : essays on Carl Schmitt "
JQ1681-J-2015,JQ,Japan's multilayered democracy 
JN1572-D-2015,JN,Multi-level governance and Northern Ireland 
JC311-M-2015,JC,Nationalism
JN6581-P-2016,JN,Politics and legitimacy in post-Soviet Eurasia 
JZ1306-A-2016,JZ,A practice of ethics for global politics : ethical reflexivity 
JV6035-B-2016,JV,Beyond networks : feedback in international migration 
JZ5588-D-2015,JZ,Biopolitics of security : a political analytic of finitude 
JF801-A-2015,JF,Citizenship
JZ1480-G-2016,JZ,Communitarian foreign policy : Amitai Etzioni's vision 
JC355-H-2015,JC,Comparative federalism : a systematic inquiry 
JZ4059-B-2016,JZ,Confounding powers : anarchy and international society from the assassins to Al Qaeda 
JZ1305-C-2016,JZ,Critical imaginations in international relations 
JC574-G-2015,JC,Dangerous thinking in the age of the new authoritarianism 
JC423-N-2015,JC,Deliberative democracy between theory and practice 
JZ5332-C-2016,JZ,The formulation of EU foreign policy : socialization
JZ5588-K-2015,JZ,Global security in the twenty-first century : the quest for power and the search for peace 
JZ1318-S-2015,JZ,Globalization : the paradox of organizational behavior : terrorism
JZ1254-S-2016,JZ,The hacked world order : how nations fight
JQ750-S-2015,JQ,The making of Southeast Asian nations : state
JZ5595-D-2015,JZ,Mediterranean paradiplomacies : the dynamics of diplomatic reterritorialization 
JZ5584-P-2015,JZ,Paradoxes of peace in nineteenth century Europe 
JZ5584-S-2015,JZ,Peacebuilding and ex-combatants : political reintegration in Liberia 
JQ1875-P-2015,JQ,The politics of governance : actors and articulations in Africa and beyond 
JZ5538-P-2016,JZ,The politics of international intervention : the tyranny of peace 
JF2051-P-2015,JF,The politics of party leadership : a cross-national perspective 
JF51-B-2015,JF,Power-sharing in conflict-ridden societies : challenges for building peace and democratic stability 
JZ1480-A-2015,JZ,America
JF2051-B-2015,JF,Building blocs : how parties organize society 
JZ1730-C-2015,JZ,The China challenge : shaping the choices of a rising power 
JV2218-C-2015,JV,Colonialism and national identity 
JV51-L-2015,JV,Colonialism
JQ1879-D-2015,JQ,Democratic contestation on the margins : regimes in small African countries 
JN1361-A-2015,JN,Ethics and integrity in British politics : how citizens judge their politicians' conduct and why it matters 
JZ5675-D-2015,JZ,The ethics of nuclear weapons dissemination : moral dilemmas of aspiration
JZ1570-E-2015,JZ,Europe in emerging Asia : opportunities and obstacles in political and economic encounters 
JZ1318-G-2015,JZ,Global governance and democracy : a multidisciplinary analysis 
JZ1318-N-2015,JZ,Globalization and culture : global mélange 
JQ24-G-2015,JQ,Governance in developing Asia : public service delivery and empowerment 
JA75-G-2015,JA,Green parties
JF1525-H-2014,JF,Handbook of research on democratic strategies and citizen-centered e-government services 
JF1525-I-2015,JF,Information and communication technologies in public administration : innovations from developed countries 
JZ1313-I-2016,JZ,Is the West in decline? : historical
JN1129-S-2015,JN,The Liberal Party and the economy
JZ1318-W-2015,JZ,Making human : world order and the global governance of human dignity 
JF1351-N-2015,JF,Public management : performance
JN2606-L-2015,JN,Cohabitation and conflicting politics in French policymaking 
JZ1316-C-2015,JZ,The concept of the State in international relations : philosophy
JZ6377-B-2015,JZ,Cooperative peacekeeping in Africa : exploring regime complexity 
JZ1308-W-2015,JZ,Deep cosmopolis : rethinking world politics and globalisation 
JQ1981-H-2015,JQ,Democracy as death : the moral order of anti-liberal politics in South Africa 
JC423-H-2015,JC,Democracy promotion and foreign policy : identity and interests in US
JN1155-C-2015,JN,Devolution and governance : Wales between capacity and constraint 
JZ4839-S-2015,JZ,Digital diplomacy : conversations on innovation in foreign policy 
JZ1312-D-2015,JZ,Domination and global political justice : conceptual
JV51-B-2016,JV,Empires of remorse : narrative
JZ1570-E-2015,JZ,The European Union's Eastern neighbourhood today : politics
JA86-K-2015,JA,Field research in political science : practices and principles 
JZ5625-K-2015,JZ,Great power security cooperation : arms control and the challenge of technological change 
JV6483-I-2015,JV,Immigration detention : the migration of a policy and its human impact 
JV8755-I-2014,JV,Immigration in Singapore 
JQ231-I-2014,JQ,India alive 
JZ5675-A-2015,JZ,India
JZ5675-I-2016,JZ,International cooperation on WMD nonproliferation 
JZ6405-N-2015,JZ,Necropolitics (2015) http:
JZ5330-O-2015,JZ,Networked regionalism as conflict management 
JC153-B-2015,JC,Order and conflict : Anthony Ascham and English political thought
JF1001-P-2015,JF,Personality politics? : the role of leader evaluations in democratic elections 
JA85-W-2015,JA,The politics of common sense : how social movements use public discourse to change politics and win acceptance 
JC319-A-2015,JC,The anomie of the earth : philosophy
JZ6009-A-2015,JZ,Asia's security 
JQ1849-B-2015,JQ,The Bacthification of Iraq : Saddam Hussein's totalitarianism 
JV8701-C-2015,JV,Chinese migration to Europe : Prato
JQ1879-C-2015,JQ,Democracy in Africa : successes
JQ1499-D-2015,JQ,Democratic governance in Northeast Asia : a human-centered approach to evaluating democracy 
JA75-E-2014,JA,Engaging nature : environmentalism and the political theory canon 
JN36-E-2015,JN,The European parliament and its international relations 
JN15-N-2015,JN,How Germany unified and the EU enlarged : negotiating the accession through transplantation and adaptation 
JN1571-M-2014,JN,How parties win : shaping the Irish political arena 
JF801-S-2015,JF,Integration and new limits on citizenship rights : Denmark and beyond 
JZ1745-H-2015,JZ,Japan's foreign and security policy under the 'Abe Doctrine' : new dynamism or new dead end? 
JN6693-P-2016,JN,National minorities in Putin's Russia : diversity and assimilation 
JZ5665-T-2015,JZ,Nuclear weapons and international security : collected essays 
JQ3198-P-2015,JQ,Political and constitutional transitions in North Africa : actors and factors 
JA75-P-2015,JA,The politics of green transformations 
JF1351-P-2015,JF,Politics of representative bureaucracy : power
JZ1480-S-2015,JZ,The politics of subjectivity in American foreign policy discourses 
JN40-V-2015,JN,Populist parties in Europe : agents of discontent? 
JF1525-P-2016,JF,Public service operations management : a research handbook 
JZ4841-R-2015,JZ,Between Samaritans and states : the political ethics of humanitarian INGOs 
JC319-K-2016,JC,Classical geopolitics : a new analytical model 
JN1129-P-2015,JN,Clear blue water? : the Conservative Party and the welfare state since 1940 
JZ6009-E-2016,JZ,European security : critical concepts in military
JV2511-E-2015,JV,Exploring the Dutch Empire : agents
JQ1981-T-2015,JQ,The eye of the needle : towards participatory democracy in South Africa 
JZ1570-T-2015,JZ,Fear and the making of foreign policy : Europe and beyond 
JQ3981-A-2015,JQ,Gender
JN1129-T-2015,JN,A history of the British Labour Party 
JN297-H-2015,JN,Knowledge
JQ1879-N-2015,JQ,National democratic reforms in Africa : changes and challenges 
JQ2998-C-2016,JQ,Negotiating corruption : NGOs
JF529-O-2015,JF,The organization ecology of interest communities : assessment and agenda 
JV8752-A-2015,JV,Pain
JF1525-P-2015,JF,Public procurement for innovation 
JZ1308-R-2016,JZ,Re-grounding cosmopolitanism : towards a post-foundational cosmopolitanism 
JQ1875-R-2015,JQ,Real governance and practical norms in sub-Saharan Africa : the game of rules 
JZ1307-B-2016,JZ,Realpolitik : a history 
JC423-R-2015,JC,Reclaiming democracy : judgment
JA80-R-2016,JA,Resisting biopolitics : philosophical
JZ1312-W-2015,JZ,Rethinking hegemony 
JF51-R-2015,JF,Routledge handbook of comparative political institutions 
JQ750-R-2015,JQ,Routledge handbook of Southeast Asian democratization 
JC491-S-2015,JC,Scripting revolution : a historical approach to the comparative study of revolutions 
JV105-V-2015,JV,The settler colonial present 
JQ790-S-2016,JQ,Social democracy in East Timor 
JC329-M-2016,JC,The temporality of political obligation 
JZ1308-P-2015,JZ,Transnational cooperation : an issue-based approach 
JC423-T-2016,JC,The trouble with democracy : political modernity in the 21st century 
JZ5009-H-2015,JZ,United Nations Centre on transnational corporations : corporate conduct and the public interest 
JC423-M-2015,JC,Why democracy is oppositional 
JC11-C-2015,JC,The world of states 
JC253-H-2015,JC,Reconsidering C.B. Macpherson : from possessive individualism to democratic theory and beyond 
JZ1745-H-2015,JZ,Regional risk and security in Japan : whither the everyday 
JA81-C-2015,JA,Reviewing political criticism : journals
JC71-K-2015,JC,The rhetoric of Plato's Republic : democracy and the philosophical problem of persuasion 
JC421-H-2015,JC,The rise of democracy : revolution
JA75-R-2015,JA,The Routledge handbook of political ecology 
JC327-L-2015,JC,Self-determination and collective responsibility in the secessionist struggle 
JQ1981-S-2015,JQ,Singing
JF1525-S-2015,JF,State transformations in OECD countries : dimensions
JC327-T-2015,JC,Territorial separatism in global politics : causes
JC229-K-2015,JC,Tocqueville
JF1525-T-2015,JF,Tracing the political 
JN7066-H-2016,JN,Trust us : reproducing the nation and the Scandinavian nationalist populist parties 
JN30-B-2016,JN,Understanding EU decision-making 
JA83-C-2015,JA,Undoing ties : political philosophy at the waning of the state 
JZ1480-H-2015,JZ,Has Obama made the world a more dangerous place? : Stephens and Kagan vs. Zakaria and Slaughter : the Munk debate on U.S. foreign policy 
JK246-D-2015,JK,Democracy and the origins of the American regulatory state 
JN40-D-2015,JN,A different kind of democracy? : debates about democracy and the European Union 
JZ1254-D-2015,JZ,Diplomacy for the 21st Century : embedding a culture of science and technology throughout the Department of State 
JQ4040-R-2014,JQ,The gatekeepers : lessons from prime ministers' chiefs of staff 
JZ4850-K-2015,JZ,International organizations : the politics and processes of global governance 
JQ629-P-2015,JQ,Jago Pakistan = Wake up
JZ5597-M-2015,JZ,Managing conflict in a world adrift 
JZ1305-F-2015,JZ,Mimetic politics : dyadic patterns in global politics 
JZ5538-C-2015,JZ,Morton Deutsch : major texts on peace psychology 
JF51-S-2014,JF,Northern lights : the positive policy example of Sweden
JN621-S-2015,JN,"Essays. Selections+""A parliamentary miscellany : papers on the history of the House of Lords"
JA84-L-2015,JA,Political ideology in Britain 
JA81-A-2016,JA,Political questions : political philosophy from Plato to Pinker 
JN8395-I-2015,JN,"Disputar la democracia. English+""Politics in a time of crisis : Podemos and the future of European democracy "
JF1525-M-2015,JF,The quest for good governance : how societies develop control of corruption 
JK421-K-2015,JK,Red tape
JZ6009-A-2014,JZ,Securing Sierra Leone
JZ5588-S-2015,JZ,"Security (Cambridge University Press)+""Security : dialogue across disciplines "
JA81-N-2015,JA,Western political thought : from Socrates to the age of ideology 
JK271-W-2015,JK,What is conservatism? 
JA86-B-2016,JA,Writing a research paper in political science : a practical guide to inquiry
JN976-J-2015,JN,The transfiguring sword : the just war of the women's social and political union 
JQ2951-E-2014,JQ,Elections in a hybrid regime : revisiting the 2011 Ugandan polls 
JF1525-E-2015,JF,Electronic government : 14th IFIP WG 8.5 International Conference
JV6271-F-2015,JV,A fair deal on talent : fostering just migration governance : lessons from around the globe 
JF799-W-2015,JF,Forging trust communities : how technology changes politics 
JZ1310-M-2015,JZ,Thinking the twenty-first century : ideas for the new political economy 
JZ4984-H-2015,JZ,The United Nations : a very short introduction 
JZ5578-W-2015,JZ,Women
JZ1320-R-2015,JZ,Research in global citizenship education 
JC571-J-2015,JC,Closing the rights gap : from human rights to social transformation 
JZ1318-B-2016,JZ,Between past orthodoxies and the future of globalization : contemporary philosophical problems 
JN9609-B-2015,JN,Changing images of the left in Bulgaria : the challenge of post-communism in the early 21st century 
JZ1427-P-2015,JZ,China's strong arm : protecting citizens and assets abroad 
JN621-C-2015,JN,Commons and lords : a short anthropology of Parliament 
JC330-D-2015,JC,Democratic transitions : conversations with world leaders 
JF1525-A-2015,JF,E-government strategy
JF1525-F-2016,JF,The five disciplines of intelligence collection 
JV7282-O-2015,JV,Flight and freedom : stories of escape to Canada 
JF1351-H-2015,JF,Handbook of public administration 
JC251-N-2015,JC,Hannah Arendt and the politics of friendship 
JF1351-H-2015,JF,Irregular governance : a plea for bold organizational experimentation 
JZ1242-H-2016,JZ,Kalevi Holsti : a pioneer in international relations theory
JZ6009-M-2014,JZ,Middle Eastern security
JV6483-M-2015,JV,Refuge in the Lord : Catholics
JV7590-R-2014,JV,Rethinking the attractiveness of EU labour immigration policies : comparative perspectives on the EU
JN238-L-2015,JN,The risk of BREXIT : Britain and Europe in 2015 
JZ4986-W-2015,JZ,Wartime origins and the future United Nations 
JZ5540-D-2016,JZ,Women Nobel Peace Prize winners 
