Title,ISBN
Anti-Federalists versus Federalists : selected documents /,
"Democratic-Republican societies, 1790-1800 /",
Journal of the Federal Convention /,
The debates in the Federal Convention of 1787 which framed the constitution of the United States of America /,
"The antifederalists : critics of the constitution, 1781-1788 /",
"Confederation and constitution, 1781-1789 /",
"E pluribus unum : the formation of the American Republic, 1776-1790 /",
We the people : the economic origins of the Constitution /,
The Confederation and the Constitution /,
"The forging of the Union, 1781-1789 /",9780060157333;006015733X
"The American states during and after the Revolution, 1775-1789 /",
The ordeal of the constitution. The Antifederalists and the ratification struggle of 1787-1788 /,
The constitution of the United States : an historical survey of its formation /,
James Madison's notes of debates in the Federal Convention of 1787 and their relation to a more perfect society of nations /,
The great rehearsal : the story of the making and ratifying of the Constitution of the United States /,
"Party and faction in American politics : the House of Representatives, 1789-1801 /",9780837163567;0837163560
"The Federal age, 1789-1829 : America in the process of becoming /",
"Parties and politics in the early republic, 1789-1815 /",
"The other founders : Anti-Federalism and the dissenting tradition in America, 1788-1828 /",9780807825037;0807825034;9780807847862;0807847860
"Circular Letters of Congressmen to their Constituents, 1789-1829 /",9780807812891;0807812897
"The Democratic-Republican societies, 1790-1800 : a documentary sourcebook of constitutions, declarations, addresses, resolutions, and toasts /",9780837189079;0837189071
Transatlantic radicals and the early American Republic /,9780700608232;0700608230
The age of federalism /,9780195068900;0195068904
The age of federalism /,9780195093810;019509381X
From the Declaration of Independence to the constitution : the roots of American constitutionalism /,
The new republic : the United States of America 1789-1815 /,9780582292871;0582292875
"Federalists, Republicans and foreign entanglements, 1789-1815 /",
"The Federalist era, 1789-1801 /",
Parades and the politics of the street : festive culture in the early American republic /,9780812233995;0812233999
The founding fathers /,
American politics in the early republic : the new nation in crisis /,9780300055306;0300055307
The American Revolution of 1800 /,
"The democratic republic, 1801-1815 /",
The republic reborn : war and the making of liberal America 1790-1820 /,9780801839412;0801839416
"The republic reborn : war and the making of liberal America, 1790-1820 /",9780801834202;0801834201
To the Farewell Address : ideas of early American foreign policy /,9780691005744;0691005745
Washington and his colleagues : a chronicle of the rise and fall of federalism /,
The presidency of George Washington /,
"The diaries of George Washington, 1748-1799 /",
"The writings of George Washington, from the original manuscript sources, 1745-1799 /",
"The writings of George Washington, from the original manuscript sources, 1745-1799 /",
"The writings of George Washington, from the original manuscript sources, 1745-1799 /",
"The writings of George Washington, from the original manuscript sources, 1745-1799 /",
"The writings of George Washington, from the original manuscript sources, 1745-1799 /",
"The writings of George Washington, from the original manuscript sources, 1745-1799 /",
"The writings of George Washington, from the original manuscript sources, 1745-1799 /",
"The writings of George Washington, from the original manuscript sources, 1745-1799 /",
"The writings of George Washington, from the original manuscript sources, 1745-1799 /",
"The writings of George Washington, from the original manuscript sources, 1745-1799 /",
"The writings of George Washington, from the original manuscript sources, 1745-1799 /",
George Washington /,
Washington : a life /,0143119966;9780143119968
George Washington in the Ohio Valley /,
The unknown Washington : biographic origins of the Republic /,
George Washington : man and monument /,
Washington : a biography /,9780399116179;0399116176
"George Washington : the forge of experience, (1732-1775) /",
"George Washington in the American revolution, 1775-1783 /",
The true George Washington /,
George Washington /,
George Washington : a biography /,
George Washington : a biography /,
George Washington : a biography /,
George Washington : a biography /,
George Washington : a biography /,
Washington /,
Pictorial life of George Washington /,
"David Humphreys' ""Life of General Washington"" : with George Washington's ""remarks"" /",9780820312934;0820312932
General Washington /,
"George Washington : the Virginia period, 1732-1775 /",
George Washington /,
The life of George Washington /,
"The home of Washington and its associations, historical, biographical and pictorial /",
"Washington's farewell address in facsimile, with transliterations of all the drafts of Washington, Madison and Hamilton, together with their correspondence and other supporting documents /",
George Washington : the making of an American symbol /,9780029281413;0029281415
George Washington : a profile /,
The facts about George Washington as a Freemason /,
The Life of Washington /,
George Washington : the image and the man /,
Washington and the American revolution /,
George Washington in and as culture : bicentenary explorations /,9780404642563;040464256X;9780404635381;0404635385
The invention of George Washington /,9780520062726;0520062728
George Washington slept here : colonial revivals and American culture 1876-1986 /,9780674349513;0674349512
"""Worthy partner"" : the papers of Martha Washington /",9780313280245;031328024X
"Washington and the Revolution, a reappraisal : Gates, Conway and the Continental Congress /",
George Washington and the new nation (1783-1793) /,
George Washington and American constitutionalism /,9780700605644;0700605649
Cincinnatus : George Washington and the Enlightenment /,9780385175623;0385175620
The Genius of George Washington /,9780393014402;0393014401
The papers of George Washington : Revolutionary War series /,9780813911021;0813911028
The papers of George Washington : Revolutionary War series /,9780813911670;0813911672
The papers of George Washington : Revolutionary War series /,9780813913070;0813913071
The papers of George Washington : Revolutionary War series /,9780813914473;0813914477
The papers of George Washington : Revolutionary War series /,9780813915388;0813915384
The papers of George Washington : Revolutionary War series /,9780813916484;0813916488
The papers of George Washington : Revolutionary War series /,9780813917870;0813917875
The papers of George Washington : Revolutionary War series /,9780813918259;0813918251
The papers of George Washington : Revolutionary War series /,9780813919010;0813919010
The papers of George Washington : Revolutionary War series /,9780813920269;0813920264
The papers of George Washington : Revolutionary war series /,9780813920771;0813920779
The papers of George Washington : Revolutionary war series /,9780813922201;0813922208
The papers of George Washington : Revolutionary war series /,9780813925226;0813925223
The papers of George Washington : Revolutionary war series.,081392684X;9780813926841
The papers of George Washington : Revolutionary war series.,0813927218;9780813927213
The papers of George Washington : Revolutionary war series.,081392961X;9780813929613
The papers of George Washington : Revolutionary wars series /,9780813910406;0813910404
The papers of George Washington : Revolutionary wars series /,9780813922829;0813922828
The papers of George Washington : colonial series /,9780813909127;0813909120
The papers of George Washington : colonial series /,9780813909233;0813909236
The papers of George Washington : colonial series /,9780813910031;081391003X
The papers of George Washington : colonial series /,9780813910062;0813910064
The papers of George Washington : colonial series /,9780813911441;0813911443
The papers of George Washington : colonial series /,9780813911458;0813911451
The papers of George Washington : colonial series /,9780813912363;0813912369
The papers of George Washington : colonial series /,9780813913629;0813913624
The papers of George Washington : colonial series /,9780813914657;0813914655
The papers of George Washington : colonial series /,9780813915500;0813915503
The papers of George Washington : presidential series /,9780813911038;0813911036
The papers of George Washington : presidential series /,9780813911052;0813911052
The papers of George Washington : presidential series /,9780813912103;0813912105
The papers of George Washington : presidential series /,9780813914077;0813914078
The papers of George Washington : presidential series /,9780813916194;0813916194
The papers of George Washington : presidential series /,9780813916378;0813916372
The papers of George Washington : presidential series /,9780813917498;0813917492
The papers of George Washington : presidential series /,9780813918105;0813918103
The papers of George Washington : presidential series /,9780813919225;0813919223
The papers of George Washington : presidential series /,9780813921013;0813921015
The papers of George Washington : presidential series /,9780813921235;0813921236
The papers of George Washington : presidential series /,9780813923147;081392314X
The papers of George Washington : presidential series.,0813926343;9780813926346
The papers of George Washington : presidential series.,0813927595;9780813927596
The papers of George Washington : presidential series.,081392846X;9780813928463
A sacred union of citizens : George Washington's farewell address and the American character /,9780847682614;0847682617
"Pinckney's Treaty : America's advantage from Europe's distress, 1783-1800 /",
The Monroe mission to France 1794-1796 /,
"Number 7 : Alexander Hamilton's secret attempts to control American foreign policy, with supporting documents /",
The French Revolution and the American man of letters /,
"French refugee life in the United States, 1790-1800 : an American chapter of the French revolution /",
Entangling alliance : politics and diplomacy under George Washington /,
The revolutionary spirit in France and America /,
"Alexander Hamilton and the British orientation of American foreign policy, 1783-1803 /",
"The first rapprochement : England and the United States, 1795-1805 /",
Britain and France at the birth of America : the European powers and the peace negotiations of 1782-1783 /,9780859896153;0859896153
George Washington and the French revolution /,
American neutrality in 1793 : a study in cabinet government /,
Jay's Treaty : a study in commerce and diplomacy /,
The Jay Treaty : political battleground of the founding fathers /,
"The Whiskey Rebellion : George Washington, Alexander Hamilton, and the frontier rebels who challenged America's newfound sovereignty /",0743254902;9780743254908;0743254910;9780743254915
The Whiskey Rebellion : past and present perspectives /,9780313245343;0313245347
The first presidential contest : 1796 and the founding of American democracy /,0700619070;9780700619078
The Presidency of John Adams /,9780700601349;0700601341
The Adams Federalists /,
Passionate sage : the character and legacy of John Adams /,0393311333;9780393311334;9780393034790;0393034798
The presidency of John Adams : the collapse of Federalism 1795-1800 /,
"New letters of Abigail Adams, 1788-1801 /",
The Adams-Jefferson letters : the complete correspondence between Thomas Jefferson and Abigail and John Adams /,
The selected writings of John and John Quincy Adams /,
"The spur of fame : dialogues of John Adams and Benjamin Rush, 1805-1813 /",
Adams and Jefferson : the story of a friendship /,
John Adams and the American Revolution /,
Honest John Adams /,
John Adams /,9780684813639;0684813637
"The meaning of independence : John Adams, George Washington, Thomas Jefferson /",
The character of John Adams /,9780807812549;0807812544
John Adams /,
Abigail Adams /,
Abigail Adams : an American Woman /,9780316020404;0316020400
Portraits of John and Abigail Adams /,
Adams family correspondence /,
Adams family correspondence /,9780674004061;067400406X
The Adams family /,
Adams : an American dynasty /,9780070543027;007054302X
Diary and autobiography of John Adams /,
"The earliest diary of John Adams : June 1753 - April 1754, September 1758 - January 1759 /",
"The quasi-war : the politics and diplomacy of the undeclared war with France, 1797-1801 /",
"The controversy over neutral rights between the United States and France, 1797-1800 : a collection of American State Papers and judicial decisions /",
Fries's Rebellion : the enduring struggle for the American Revolution /,9780812238150;081223815X
Crisis in freedom : the Alien and Sedition Acts /,
"The revolution of 1800 : democracy, race, and the New Republic /",9780813921419;0813921414;9780813921402;0813921406
"The failure of the founding fathers : Jefferson, Marshall, and the rise of presidential democracy /",9780674018662;0674018664
History of the United States during the administrations of Jefferson and Madison /,
History of the United States of America (1801-1817) /,
History of the United States of America during the Administrations of Jefferson and Madison /,9780226005126;0226005127
"The Jeffersonian Republicans in power : party operations, 1801-1809 /",
The Jeffersonian crisis : court and politics in the young republic /,
The Revolution of American Conservatism /,
Jefferson and his colleagues : a chronicle of the Virginia dynasty /,
The papers of Thomas Jefferson.,9780691118956;0691118957
Jefferson himself : the personal narrative of a many-sided American /,
Jefferson's literary commonplace book /,9780691047201;0691047200
"Jefferson's memorandum books : accounts, with legal records and miscellany, 1767-1826 /",
"Jefferson's memorandum books : accounts, with legal records and miscellany, 1767-1826 /",9780691047195;0691047197
Jefferson's parliamentary writings /,9780691047133;0691047138
The Papers of Thomas Jefferson : retirement series.,0691137714;9780691137711
The Papers of Thomas Jefferson : retirement series.,9780691128672;0691128677
The living thoughts of Thomas Jefferson /,
The papers /,
The papers /,
The papers /,
The papers /,
The papers /,
The papers /,
The papers /,
The papers /,
The papers /,
The papers /,
The papers /,
The papers /,9780691015859;0691015856
The papers /,9780691045825;0691045828
The papers /,9780691045825;0691045828
The papers /,9780691046877;0691046875
The papers /,9780691047287;0691047286
The papers /,9780691047393;0691047391
The papers /,9780691047768;0691047766
The papers /,9780691047775;0691047774
The papers /,9780691047782;0691047782
The papers /,9780691047805;0691047804
The papers /,9780691090436;0691090432
The papers of Thomas Jefferson /,9780691094984;0691094985
The papers of Thomas Jefferson /,9780691129105;069112910X
"The papers of Thomas Jefferson, retirement series.",0691137722;9780691137728
"The papers of Thomas Jefferson, retirement series.",9780691124902;0691124906
The papers of Thomas Jefferson.,0691135576;9780691135571
The papers of Thomas Jefferson.,0691137730;9780691137735
The papers of Thomas Jefferson.,0691137749;9780691137742
The papers of Thomas Jefferson.,069115001X;9780691150017
The papers of Thomas Jefferson.,069115323X;9780691153230
The papers of Thomas Jefferson.,9780691121215;0691121214
The papers of Thomas Jefferson.,9780691124896;0691124892
"The republic of letters : the correspondence between Thomas Jefferson and James Madison, 1776-1826 /",
Writings /,9780940450165;094045016X
The living Jefferson /,
Thomas Jefferson and American democracy /,
Thomas Jefferson as social scientist /,
The lost world of Thomas Jefferson /,
Jefferson and Hamilton : the struggle for democracy in America /,
Jefferson in power : the death struggle of the Federalists /,
Thomas Jefferson : an Intimate History /,
Thomas Jefferson : the apostle of Americanism /,
In pursuit of reason : the life of Thomas Jefferson /,9780807113752;0807113751
The head and heart of Thomas Jefferson /,
Thomas Jefferson : fighter for freedom and human rights /,
Was Thomas Jefferson an authentic enemy of slavery? /,
"Thomas Jefferson, American tourist : being an account of his journeys in the United States of America, England, France, Italy, the Low Countries and Germany /",9780806113531;0806113537
Thomas Jefferson : author of America /,0007213727;9780007213726
Life and letters of Thomas Jefferson /,
The correspondence of Jefferson and Du Pont de Nemours /,
The life and selected writings of Thomas Jefferson /,
Jefferson and the presidency : leadership in the young republic /,9780801411502;0801411505
Jefferson and France : an essay on politics and political ideas /,
Jefferson and Madison : the great collaboration /,
The philosophy of Thomas Jefferson /,
Jefferson and his Time /,
Jefferson and his Time /,
Jefferson and his Time /,
Jefferson and his Time /,
Jefferson and his Time /,9780316544634;0316544639
Jefferson and his time /,
Thomas Jefferson as political leader /,
The constitutional thought of Thomas Jefferson /,9780813914848;0813914841
Jefferson /,
The Age of Revolutions.,9780335005642;0335005640
The Jefferson image in the American mind /,9780195006988;0195006984
Jefferson /,
Thomas Jefferson and the foundations of American freedom /,
The constitutional principles of Thomas Jefferson /,
Thomas Jefferson : a profile /,
Thomas Jefferson and the new nation : a biography /,9780195019094;0195019091
The life of Thomas Jefferson /,
The domestic life of Thomas Jefferson : compiled from family letters and reminiscences by his great-granddaughter /,
Thomas Jefferson : a biography /,
"Thomas Jefferson : the man, his world, his influence /",
Madison and Jefferson /,1400067286;9781400067282
American Sphinx : the character of Thomas Jefferson /,9780679764410;0679764410
"Declaring independence : Jefferson, natural language & the culture of performance /",9780804720755;0804720754;9780804720762;0804720762
Thomas Jefferson and Sally Hemmings : An American Controversy /,0813918332;9780813918334
Thomas Jefferson and the Stony Mountains : Exploring the West from Monticello /,9780252008238;0252008235
Jeffersonian legacies /,9780813914633;0813914639
"Jefferson and the iconography of romanticism : folk, land, culture and the romantic nation /",9780333698242;033369824X
On the sources of patriarchal rage : the commonplace books of William Byrd and Thomas Jefferson and the gendering of power in the eighteenth century /,9780814750698;0814750699
The radical politics of Thomas Jefferson : a revisionist view /,9780700602568;0700602569
Jefferson and nature : an interpretation /,9780801847295;080184729X
The wolf by the ears : Thomas Jefferson and slavery /,9780029215005;0029215005
Jefferson's empire : the language of American nationhood /,9780813919300;0813919304
Reason and republicanism : Thomas Jefferson's legacy of liberty /,9780847685219;0847685217
"Sally Hemings & Thomas Jefferson : history, memory, and civic culture /",9780813919188;0813919185;9780813919195;0813919193
"""Those who labor for my happiness"" : slavery at Thomas Jefferson's Monticello /",0813932238;9780813932231
The Paris years of Thomas Jefferson /,9780300069037;0300069030
The long affair : Thomas Jefferson and the French Revolution /,9781856196376;1856196372
Empire of liberty : the statecraft of Thomas Jefferson /,9780195062076;0195062078
The Hemingses of Monticello : an American family /,0393064778;9780393064773
Thomas Jefferson and American Democracy /,9780669735444;0669735442
"The Complete Jefferson : containing his Major Writings, published and unpublished, Except his Letters /",
The portable Thomas Jefferson /,9780140150803;0140150803
The portable Thomas Jefferson /,9780670703593;0670703591;9780670010806;0670010804
To his excellency Thomas Jefferson : letters to a president /,9780393030167;0393030164
Jefferson at Monticello /,
The nation's crucible : the Louisiana Purchase and the creation of America /,9780300101195;0300101198;9780300194616;0300194617
The Burr conspiracy /,
"Breaking with Burr : Harman Blennerhassett's journal, 1807 /",9780821408605;0821408607
The Aaron Burr conspiracy /,
Our navy and the Barbary corsairs /,
The papers of Henry Clay /,
The papers of Henry Clay /,
The papers of Henry Clay /,
The papers of Henry Clay /,
The papers of Henry Clay /,
The papers of Henry Clay /,9780813100562;0813100569
The papers of Henry Clay /,9780813100579;0813100577
The papers of Henry Clay /,9780813100586;0813100585
The papers of Henry Clay /,9780813100593;0813100593
The papers of Henry Clay /,9780813100616;0813100615
The Federalists vs. the Jeffersonian Republicans /,
Expansion and reform 1815-1850 /,
Rude republic : Americans and their politics in the nineteenth century /,0691089868;9780691089867
Rude republic : Americans and their politics in the nineteenth century /,9780691001302;0691001308
A Companion to 19th-century America /,9780631209850;0631209859
A century of political cartoons : caricature in the United States from 1800 to 1900 /,9780374960926;0374960925
The papers of Daniel Webster. Series 3 = Diplomatic papers /,9780874512458;087451245X
The papers of Daniel Webster. Series 3 = Diplomatic papers /,9780874513738;0874513731
Correspondence of James K. Polk /,
Correspondence of James K. Polk /,
Correspondence of James K. Polk /,
Correspondence of James K. Polk /,
Correspondence of James K. Polk /,
Correspondence of James K. Polk /,9780826512116;0826512119
Correspondence of James K. Polk /,9780826512253;0826512259
Guide and index to the microfilm edition of the papers of Daniel Webster /,
The writings and speeches of Daniel Webster /,
The letters of Daniel Webster : from documents owned principally by the New Hampshire Historical Society /,
The papers of Daniel Webster. General index /,9780874514476;0874514479
The papers of Daniel Webster. Series 1 = Correspondence /,9780874510966;0874510961
The papers of Daniel Webster. Series 1 = Correspondence /,9780874511208;0874511208
The papers of Daniel Webster. Series 1 = Correspondence /,9780874511314;0874511313
The papers of Daniel Webster. Series 1 = Correspondence /,9780874511697;0874511690
The papers of Daniel Webster. Series 1 = Correspondence /,9780874512311;087451231X
The papers of Daniel Webster. Series 1 = Correspondence /,9780874512946;0874512948
The papers of Daniel Webster. Series 1 = Correspondence /,9780874513233;0874513235
The papers of Daniel Webster. Series 2 = Legal papers /,9780874512328;0874512328
The papers of Daniel Webster. Series 2 = Legal papers /,9780874512403;0874512409
The papers of Daniel Webster. Series 2 = Legal papers /,9780874514100;087451410X
The papers of Daniel Webster. Series 4 = Speeches and formal writings /,9780874513578;087451357X
The papers of Daniel Webster. Series 4 = Speeches and formal writings /,9780874514155;0874514150
"Slavery, capitalism, and politics in the antebellum republic.",0521474876;9780521474870;0521479940;9780521479943
"""Agrarians"" and ""aristocrats"" : party political ideology in the United States, 1837-1846 /",9780901050878;0901050873
Social theories of Jacksonian democracy : representative writings of the period 1825-1850 /,
The social ideas of the Northern evangelists /,
"The Jacksonian promise : America, 1815-1840 /",9780801851681;0801851688;9780801851674;080185167X
"The Jacksonian promise : America, 1815-1840 /",9780801851681;0801851688;9780801851674;080185167X
"Witness to the young republic : a Yankee's journal, 1828-1870 /",9780874514674;0874514673
"What hath God wrought : the transformation of America, 1815-1848 /",0195078942;9780195078947;0195392434;9780195392432
Fifty years in camp and field : diary of Major-General Ethan Allen Hitchcock /,
"The twilight of federalism : the disintegration of the Federalist Party, 1815-1830 /",
The many-faceted Jacksonian era : new interpretations /,9780837197203;0837197201
The Jacksonian persuasion : politics and belief /,
Arguing about slavery : the great battle in the United States Congress /,9780394569222;0394569229
"A history of the Whig Party, or some of its main features... /",
Famous Americans of recent times /,
"Jacksonian America : society, personality and politics /",9780252012372;0252012372
Figures from the past : from the leaves of old journals /,
Pre-Civil War reform : the variety of principles and programs /,
"Quest for America, 1810-1824 /",
"Public men and events from the commencement of Mr Monroe's administration, in 1817, to the close of Mr Fillmore's administration, in 1853 /",
"The American political nation, 1838-1893 /",9780804718783;0804718784
The partisan imperative : the dynamics of American politics before the Civil War /,9780195035513;0195035518
"The house divides : the age of Jackson and Lincoln, from the War of 1812 to the Civil War /",
"The United States and the independence of Latin America, 1800-1830 /",
"The new nation, 1800-1845 /",
The Washington community 1800-1828 /,
"The great triumvirate : Webster, Clay and Calhoun /",9780195056860;0195056868
Representative Americans : the romantics /,9780742520837;0742520838;9780742520820;074252082X
Recollections of the early republic : selected autobiographies /,9781555533014;1555533019
The journals of Bronson Alcott /,
"Thirty years view; or, A history of the working of the American government for thirty years, from 1820 to 1850 ... by a Senator of thirty years /",
"Old Bullion Benton, Senator from the new West /",
The papers of John C. Calhoun /,
The papers of John C. Calhoun /,
