Title,ISBN
The discovery of mankind : Atlantic encounters in the age of Columbus /,0300125828;9780300125825
Les conquistadors /,9782253023869;2253023868
First Images of America : the Impact of the New World on the Old /,9780520030107;0520030109
First images of America : the impact of the New World on the Old /,9780520030107;0520030109
Marvelous possessions : the wonder of the New World /,9780198123828;0198123825;9780198122661;0198122667
The meeting of two worlds : Europe and the Americas 1492-1650 /,9780197261347;0197261345
"The European discovery of America : the northern voyages, A.D. 500-1600 /",
The great explorers : the European discovery of America /,9780195023145;0195023145
"The Northmen, Columbus and Cabot, 985-1503.",
"The age of discovery, 1400-1550 /",9780582353725;0582353726
"Early voyages and northern approaches, 1000-1632 /",
North America from earliest discovery to first settlements : the Norse voyages to 1612 /,9780060134587;0060134585
"North American discovery, circa 1000-1612 /",9780061392443;0061392448
"Race, discourse and the origin of the Americas : a new world view /",9781560985075;1560985070
Beyond geography : the western spirit against the wilderness /,0813519098;9780813519098
Beyond geography : the western spirit against the wilderness /,9780670160983;0670160989
America B.C. : ancient settlers in the New World /,9780704503274;0704503271
1491 : the Americas before Columbus /,9781862078765;1862078769
Westviking : the ancient Norse in Greenland and North America /,
Madoc and the discovery of America : some new light on an old controveersy /,
Madoc : the making of a myth /,9780413394507;0413394506
They came before Columbus : the African presence in ancient America /,9780394402451;0394402456
The invention of America : an inquiry into the historical nature of the New World and the meaning of its history /,9780837164700;0837164702
American holocaust : the conquest of the New World /,9780195075816;0195075811;9780195085570;0195085574
Seeds of change : a quincentennial commemoration /,9781560980360;1560980362
The truth about Columbus and the discovery of America /,
Columbus /,9780192852601;0192852604
The life and voyages of Christopher Columbus /,
Admiral of the Ocean Sea : a Life of Christopher Columbus /,
"Christopher Columbus, mariner /",
Worlds of Christopher Columbus /,9780521446525;052144652X
Conquest of paradise : Christopher Columbus and the Columbian legacy /,9780340533833;0340533838
"The mysterious history of Columbus : an exploration of the man, the myth, the legacy /",9780679404767;0679404767
Christopher Columbus and the new world of his discovery /,
America discovers Columbus : how an Italian explorer became an American hero /,9780874515763;0874515769
"The ""diario"" of Christopher Columbus's first voyage to America 1492-1493 /",9780806123844;0806123842
"The four voyages of Christopher Columbus : being his own log-book, letters and dispatches with connecting narrative drawn from the Life of the Admiral by his son Hernando Colon and other contemporary historians /",
The journal /,
Select documents illustrating the four voyages of Columbus.. /,
Select documents illustrating the four voyages of Columbus.. /,
Christopher Columbus and the enterprise of the Indies : a brief history with documents /,9781403968074;1403968071
"The Explorers of North America, 1492-1806 /",
The four voyages of Christopher Columbus /,9780140442175;0140442170
The search for El Dorado /,9780718117542;0718117549
"The New World : the first pictures of America...with contemporary narratives of the Huguenot settlement in Florida, 1562-1565, and the Virginia colony, 1585-1590 /",
"The European discovery of America : the southern voyages, A.D.1492-1616 /",
The discovery of South America /,9780236176755;0236176757
Sixteenth century North America : the land and the people as seen by the Europeans /,9780520018549;0520018540
"Ceremonies of possession in Europe's conquest of the New World, 1492-1640 /",9780521497572;0521497574
Columbus then and now : a life reexamined /,9780806129341;0806129344
Nature in the New World : from Christopher Colombus to Gonzalo Fernandez de Oviedo /,9780822935162;0822935163
Spain in America /,
The Spanish conquistadores /,
Conquest : the destruction of the American Indios /,0745640001;9780745640006;074564001X;9780745640013
Spain's empire in the New World : the role of ideas in institutional and social change /,9780520074101;0520074106
"Spain and Portugal and the New World, 1492-1700 /",9780196480466;0196480469
"Spanish explorers in the southern United States, 1528-1543.",
The conquest of America : the question of the other /,9780060151805;0060151803
The conquest of America : the question of the other /,9780061320958;0061320951
The conquest of America : the question of the other /,9780806131375;0806131373
The life of Las Casas /,
"Hernando de Soto : together with an account of one of his captains, Goncalo Silvestre /",
Bartolomé de Las Casas in history: toward an understanding of the man and his work /,9780875809878;0875809871
"The marvellous adventure of Cabeza de Vaca : also, Malinche /",9780285647091;0285647091
"The Hernando de Soto expedition : history, historiography and ""discovery"" in the Southeast /",9780803221574;0803221576
"Early English and French voyages, chiefly from Hakluyt, 1534-1608 /",
"Humanism and America : an intellectual history of English colonisation, 1500-1625 /",9780521822251;0521822254;9780521036184;0521036186
Undreamed shores : England's wasted empire in America /,9780245519826;0245519823
English discovery of America to 1585 /,
"England and the discovery of America, 1481-1620 : from the Bristol voyages of the fifteenth century to the Pilgrim settlement at Plymouth : the exploration, exploitation, and trial-and-error colonization of North America by the English /",
The Elizabethans' America : a collection of early reports by Englishmen on the New World /,
The Elizabethans' America : a collection of early reports by Englishmen on the New World /,
Henry Hudson /,
"The discoverie of the large, rich, and bewtiful Empyre of Guiana /",1849022356;9781849022354
Sir Walter Ralegh's Discoverie of Guiana /,9780904180879;0904180875
"Les nouvelles Frances : France in America, 1500 to 1815 : an imperial perspective /",9780916617325;0916617327
These daring disturbers of the public peace : the struggle for property and power in early New Jersey /,9780812218596;0812218590
Hidden histories of exploration : researching the RGS-IBG Collections /,1905846304;9781905846306
"Discoverers, explorers, settlers : the diligent writers of early America /",9780226260716;0226260712;9780226260723;0226260720
New World encounters /,9780520080201;0520080203;9780520080218;0520080211
Inventing America : Spanish historiography and the formation of Eurocentrism /,9780806125398;080612539X
Atlas of American history /,
Into the American woods : negotiators on the Pennsylvania frontier /,9780393046762;0393046761
"Nicknames and Sobriquets of U.S. Cities, States and Counties /",9780810812550;081081255X
American place-names : a concise and selective dictionary for the continental United States of America /,
Names on the land : a historical account of place-naming in the United States /,
Historical atlas of the United States /,
How to visit America and enjoy it /,
Look at the U.S.A..,
The American Heritage book of great historic places.,
"The United States, with an excursion into Mexico : a handbook for travellers, 1893 /",
America's wonderlands : the scenic national parks and monuments of the United States.,
"Born in the U.S.A. : birth, commemoration, and American public memory /",1558499385;9781558499386;1558499377;9781558499379
The unveiling of the national icons : a plea for patriotic iconoclasm in a nationalist era /,9780521570671;0521570670
Interpreting historic house museums /,0759102503;9780759102507;0759102511;9780759102514
Lies across America : what our historic sites get wrong /,074329629X;9780743296298
Written in stone : public monuments in changing societies /,9780822322207;082232220X
Voices from the back stairs : interpreting servants' lives at historic house museums /,0875806228;9780875806228
Reclaiming the past : landmarks of women's history /,9780253338426;0253338425
Colonials and patriots : historic places commemorating our forebears 1700-1783 /,
"Founders and frontiersmen : historic places commemorating early nationhood and the westward movement, 1783-1828.",
Program of the history of American Indians /,
Program of the history of American Indians /,
Do the Americans have a common history? A critique of the Bolton theory /,
The critical method in historical research and writing /,
A history of American history /,
Historical interpretations and American historianship /,
An American primer /,
An American primer /,9780452009226;0452009227
A history of American life and thought /,
America and the Image of Europe : Reflections on American Thought /,
An American primer /,
American civilization : an introduction to the social sciences /,
American studies in honor of William Kenneth Boyd /,
The polite Americans : 300 years of more or less good behaviour /,
"Life, liberty and the pursuit of happiness : a social history of the United States of America in documents /",
Breakthrough to the Great Society /,
Inventors of the Promised Land /,9780394472638;0394472632
The Americans : a social history of the United States 1587-1914 /,
"The beer can by the highway : essays on what's ""American"" about America /",
America through British eyes /,
The Newberry papers in family and community history : thirteen papers presented at the conference.,
This almost chosen people : essays in the history of American ideas /,
The United States /,
"American reformers, 1870-1920 : progressives in word and deed /",9780742527621;074252762X;9780742527638;0742527638
The American people : their civilization and character /,
America remembers : our best-loved customs and traditions /,
Seeds of liberty : the genesis of the American mind /,
The American as reformer /,
The stammering century /,
"America and her commentators, with a critical sketch of travel in the United States /",
Freedom's ferment : phases of American social history from the colonial period to the outbreak of the Civil War /,9780061310744;0061310743
"The saga of American society : a record of social aspiration, 1607-1937 /",
The future in America : a search after realities /,
The urgent west : an introduction to the idea of the United States /,
America's taste 1851-1959 : the cultural events of a century reported by contemporary observers in the pages of the New York Times /,
Who killed society? /,
Individualism and nationalism in American ideology /,
City on a hill : a history of ideas and myths in America /,
A literary and historical atlas of America /,
The American identity : a college reader /,
Freedom and responsibility in the American way of life /,
The promise of America : an historical enquiry /,
The American adventure : a study of bourgeois civilisation /,
The genius of American politics /,
American themes /,
The American character /,
The American problem /,
The American Idea of Mission : Concepts of National Purpose and Destiny /,
Their majesties the mob /,
The democratic vista : a dialogue on life and letters in contemporary America /,
Europe views America : a critical evaluation /,
American thought : a critical sketch /,
Living ideas in America /,
The art of democracy : a concise history of popular culture in the United States /,9780853459200;0853459207
The growth of American thought /,9780878558797;0878558799
A history of recreation : America learns to play /,
"America learns to play : a history of popular recreation, 1607-1940 /",
Inventing American tradition : from the Mayflower to Cinco de Mayo /,9781780239866;1780239866
The decline of American liberalism /,
Our America /,
The Pageant of America : a Pictorial History of the United States /,
The Pageant of America : a Pictorial History of the United States /,
The Pageant of America : a Pictorial History of the United States /,
The Pageant of America : a Pictorial History of the United States /,
The Pageant of America : a Pictorial History of the United States /,
The course of American democratic thought /,
Socialism and the American spirit /,
"Their brothers' keepers : moral stewardship in the United States, 1800-1865 /",
Crisis of the American mind /,
The dimensions of liberty /,
This was America /,
"America and French culture, 1750-1848 /",
O strange new world : American culture : the formative years /,
The pursuit of happiness /,
Cultural pluralism and the American idea : an essay in social philosophy /,
American nationalism : an interpretative essay /,
The machine in the garden : technology and the pastoral ideal in America /,9780195007381;0195007387
The machine in the garden : technology and the pastoral ideal in America /,9780195133509;0195133501;9780195133516;019513351X
Material culture : a research guide /,9780700602759;0700602755
Errand into the wilderness /,0674261550;9780674261556
The life of the mind in America : from the Revolution to the Civil War /,9780156519908;0156519909
Manifest destiny and mission in American history : a reinterpretation /,
Nature's nation /,9780674605503;0674605500
The American temper : patterns of our intellectual heritage /,
The golden day : a study in American experience and culture /,
The irony of American history /,
The American experience : an interpretation of the history and civilization of the American people /,
"Radicalism and reform : the Vrooman family and American social thought, 1837-1937 /",
Puritanism and democracy /,
Johnny Appleseed : man and myth /,
"Santayana on America : essays, notes and letters on American life, literature and philosophy /",
Paths of American thought /,
Civil tongues and polite letters in British America /,9780807823514;0807823511
Social forces in American history /,
America : a re-appraisal /,
Intellectual history in America /,
The American image of the old world /,
Redeemer nation : the idea of America's millennial role /,
The United States : a companion to American studies /,9780416415001;0416415008
The Jeffersonian tradition in American democracy /,
"The myth of the American frontier : its relevance to America, Canada and Australia /",9780718511104;0718511107
Society and thought in America /,
Society and thought in America /,
"The seventies : the great shift in American culture, society, and politics /",030681126X;9780306811265
"See America first : tourism and national identity, 1880-1940 /",9781560989530;156098953X;9781560989769;1560989769
With women's eyes : visitors to the New World 1775-1918 /,9780208023711;0208023712
"Provincial society, 1690-1763 /",
Atlantic American societies : from Columbus through abolition 1492-1888 /,9780415080736;0415080738
Cities in the wilderness : the first century of urban life in America 1625-1742 /,
The eyes of discovery : the pageant of North America as seen by the first explorers /,
"The new country : a social history of the American frontier, 1776-1890 /",
The Americans : the colonial experience /,
"Travels through the middle settlements in North-America in the years 1759 and 1760, with observations upon the state of the colonies /",
A most amazing scene of wonders : electricity and enlightenment in early America /,9780674022997;0674022998
Circles and lines : the shape of life in early America /,9780674013247;0674013247
Seasons of misery : catastrophe and colonial settlement in early America /,0812245407;9780812245400
"Journal, 1679-1680 /",
Diversity and unity in early North America /,9780415087995;0415087996
A history of travel in America /,
The transit of civilization from England to America in the seventeenth century /,
Albion's seed : four British folkways in America /,9780195069051;0195069056
"Memoirs of an American lady, with sketches of manners and scenes in America as they existed previous to the Revolution, with unpublished letters and a memoir of Mrs. Grant by James Grant Wilson /",
The intellectual construction of America : exceptionalism and identity from 1492 to 1800 /,9780807820971;0807820970
The American colonial mind and the classical tradition : essays in comparative culture /,
"Gentleman's progress : the Itinerarium of Alexander Hamilton, 1744 /",
America at 1750 : a social portrait /,9780394717951;0394717953;9780224007108;0224007106
"American incarnation : the individual, the nation, and the continent /",9780674024267;0674024265
The America of 1750 : Peter Kalm's travels in North America /,
People of Paradox : an Inquiry Concerning the Origins of American Civilization /,9780394719337;0394719336;9780394460772;0394460774
"From colonials to provincials : American thought and culture, 1680-1760 /",9780801487019;0801487013
"Materialism and morality in the American past : themes and sources, 1680-1860 /",
Travels in the American Colonies /,
Birds of passage : five Englishwomen in search of America /,9780715624296;0715624296
Of consuming interests : the style of life in the eighteenth century /,9780813914138;0813914132
"Paradox lost : free will and political liberty in American culture, 1630-1760 /",9780801843341;0801843340
"The coming of the white man, 1492-1848 /",
How early America sounded /,0801472725;9780801472725
How early America sounded /,9780801441264;0801441269
Taverns and drinking in early America /,9780801878992;0801878993
"Discovering America, 1700-1875 /",9780060137823;0060137827
Seventeenth-century America : essays in colonial history /,
The way we lived : essays and documents in American social history /,9780395959602;0395959608
The way we lived : essays and documents in American social history /,9780395959619;0395959616
The Founding of American Civilization : the Middle Colonies /,
The first Americans 1607-1690 /,
The golden age of colonial culture /,
Culture on the moving frontier /,
The Atlantic frontier : colonial American civilization 1607-1763 /,
The colonial civilisation of North America 1607-1763 /,
"The cultural life of the American colonies, 1607-1763 /",
Liberalism and republicanism in the historical imagination /,9780674530133;0674530136
"Providence and patriotism in early America, 1640-1815 /",9780813907796;0813907799
Cotton Mather and Benjamin Franklin : the price of representative personality /,9780521267687;0521267684
"The refinement of America : persons, houses, cities /",9780394550107;0394550102
"Travels in North America in the years 1780, 1781 and 1782 /",
The empire of reason : how Europe imagined and America realized the enlightenment /,9780297774211;0297774212
Letters from an American Farmer /,
The divided loyalist : Crevecoeur's America /,
"More letters from the American farmer : an edition of the essays in English, left unpublished by Crevecoeur /",9780820315997;0820315990
Le cultivateur americain : etude sur l'oeuvre de Saint John de Crevecoeur /,
The end of Anglo-America : historical essays in the study of cultural divergence /,9780719030772;0719030773
"Prodigals and pilgrims : the American revolution against patriarchal authority, 1750-1800 /",9780521237192;052123719X
"The Revolutionary Generation, 1763-1790 /",
"Imperatives, behaviors, and identities : essays in early American cultural history /",9780813914060;081391406X
"A Restless People : Americans in Rebellion, 1770-1787 /",9780385061025;0385061021
The democratic enlightenment /,9780399116865;0399116869
"The new democracy in America : travels of Francisco de Miranda in the United States, 1783-84 /",
The French Enlightenment in America : essays on the times of the founding fathers /,9780820307213;0820307211
European disunion : between sovereignty and solidarity /,0230367739;9780230367739
Abroad in America : visitors to the new nation 1776-1914 /,9780201000313;0201000318
The United States in 1800 /,
"Retrospections of America, 1797-1811 /",
"Recollections of Samuel Breck, with passages from his note-books, 1771-1862 /",
"New travels in the United States of America, 1788 /",
After the Revolution : Profiles of early American Culture /,9780393012538;0393012530
The European traveller in America : contained in three letters to his friend in London.,
Jeffersonian America : notes on the United States of America collected in the years 1805-6-7 and 11-12 /,
The republican court or American society in the days of Washington /,
Revolution and regeneration : life cycle and the historical vision of the generation of 1776 /,9780820306674;0820306673
"Orders from France : the Americans and the French in a revolutionary world, 1780-1820 /",9780812213287;0812213289
"The completion of independence, 1790-1830 /",
"The reshaping of everyday life, 1790-1840 /",9780060916060;0060916060
The cultural roots of American Islamicism /,0521852935;9780521852937;052161807X;9780521618076
Moreau de St Mery's American journey (1793-1798) /,
True yankees : The South Seas and the discovery of American identity /,1421415429;9781421415420
"America and the world : diplomacy, politics, and war /",9780815304449;0815304447
"American culture, 1776-1815 /",9780815304470;0815304471
"American society, 1776-1815 /",9780815304463;0815304463
Congress and the Confederation /,9780815304395;0815304390
Establishing the new regime : the Washington administration /,9780815304425;0815304420
Federalists and republicans /,9780815304432;0815304439
"Ratifying, amending, and interpreting the Constitution /",9780815304418;0815304412
State and local politics in the new nation /,9780815304456;0815304455
The Federal Constitution /,9780815304401;0815304404
The Revolution in American thought /,9780815304364;0815304366
"The cultural life of the new nation, 1776-1830 /",
This violent empire : the birth of an American national identity /,0807832960;9780807832967
French memories of eighteenth-century America /,
After the Revolution : the Smithsonian history of everyday life in the eighteenth century /,9780394543819;0394543815
"Empire of liberty : a history of the early Republic, 1789-1815 /",0195039149;9780195039146
Travels through the states of North America /,
"The British traveller in America, 1836-1860 /",
"Society, manners, and politics in the United States : letters on North America /",
A year's Residence in the United States of America ... /,
American notes : Pictures from Italy and A child's history of England /,
"The rise of the common man, 1830-1850 /",
Aristocracy in America : from the sketch-book of a German nobleman /,
"The Americans in their moral, social, and political relations /",
"The aristocratic journey : being the outspoken letters of Mrs. Basil Hall written during a fourteen months' sojourn in America, 1827-1828 /",
Men and manners in America /,
A diary in America : with remarks on its institutions /,
Retrospect of western travel. 2v in 1 /,
Society in America /,
Society in America /,
"Toward a new society : American thought and culture, 1800-1830 /",9780805790528;0805790527
Alternative Americas : a reading of antebellum political culture /,9780226595108;0226595102
Tocqueville in America /,0801855063;9780801855061
"Boats against the current : American culture between revolution and modernity, 1820-1860 /",9780195060911;0195060911
Three English women in America /,
The happy republic : a reader in Tocqueville's America /,
"The showman and the slave : race, death, and memory in Barnum's America /",9780674006362;0674006364
"Young America, 1830-1840 /",
"Sketches of history, life and manners, in the United States, by a traveller /",
Tocqueville in America /,
Journey to America /,
Domestic manners of the Americans /,
"My native land : life in America, 1790-1870 /",
"The mind of America, 1820-1860 /",9780231029636;0231029632
Views of society and manners in America /,
Antebellum American culture : an interpretive anthology /,9780669014761;0669014761
The Englishwoman in America /,
Midcentury America : life in the 1850s /,9780809305629;0809305623
"The anatomy of American popular culture, 1840-1861 /",
"The sentimental years, 1836-1860 /",
America of the fifties : letters of Fredrika Bremer /,
The homes of the new world : impressions of America /,
"The irrepressible conflict, 1850-1865 /",
Spectator of America /,9780575014015;0575014016
A cultural encyclopedia of the 1850s in America /,9780313285240;0313285241
"Lands of the slave and the free, or, Cuba, the United States and Canada /",
"Society and culture in America, 1830-1860 /",
"Uncle Sam and his country, or, Sketches of America, in 1854-55-56 /",
Route from Liverpool to Great Salt Lake Valley /,
Listening to nineteenth-century America /,9780807826577;080782657X;9780807849828;0807849820
Travels in the United States in 1847 /,9780691046020;0691046026
North America /,
Men of good hope : a story of American progressives /,
"The American woman's home : or, Principles of domestic science ; being a guide to the formation and maintenance of economical, healthful, beautiful, and Christian homes /",
The mauve decade : American life at the end of the nineteenth century /,
Three years among the working-classes in the United States during the war /,
The American Mind : an Interpretation of American Thought and Character since the 1880's /,
New America /,
Some impressions of the United States /,
American social thought /,
An overland journey from New York to San Francisco in the summer of 1859 /,
The response to industrialism 1885-1914 /,9780226321639;0226321630
King's handbook of the United States /,
"Through America : or, nine months in the United States /",
Society as I have found it /,
"The emergence of modern America, 1865-1878 /",
Orpheus in America : Offenbach's diary of his journey to the New World /,
